{
 "id": "urn:aidcf:syn:release-manifest:AIDCF-REL-2026.10.2",
 "type": "ReleaseManifest",
 "semanticOwner": "AIDCF-014",
 "schemaVersion": "1.3",
 "version": "1.0",
 "status": "CANDIDATE",
 "releaseRef": "AIDCF-REL-2026.10.2",
 "sourceArtifact": "AIDCF-015",
 "name": "AIDCF-015 v1.4 reference package release manifest",
 "effectiveFrom": "2026-10-10T00:00:00Z",
 "createdAt": "2026-10-10T00:00:00Z",
 "createdBy": "urn:aidcf:syn:party:BUILDER",
 "classification": "INTERNAL",
 "provenance": {
  "sourceSystem": "AIDCF-015 v1.4 tools/build_manifest.py",
  "method": "SYNTHETIC_AUTHORING",
  "synthetic": true,
  "transformationVersion": "1.4"
 },
 "description": "Bill of materials for the AIDCF-015 v1.4 synthetic reference package. Draft for controlled review; not signed; not approved.",
 "releaseId": "AIDCF-REL-2026.10.2",
 "releaseStatus": "CANDIDATE",
 "artifactManifest": [
  {
   "filePath": "CHANGELOG.md",
   "sha256": "bc0354840d0d0078ec70965f53893bd987e101ffc4018a4cb43187329f26e28e",
   "byteSize": 4862,
   "mediaType": "text/markdown"
  },
  {
   "filePath": "README.md",
   "sha256": "ea971f5e19f0d360bd05e50549f26c2533e99b5ff0fa49ad77360624d859ee2a",
   "byteSize": 12478,
   "mediaType": "text/markdown"
  },
  {
   "filePath": "baseline/baseline-declaration.json",
   "sha256": "067c130c45b17e2bc54aee5105d2947dd3a26e200bced912967f77b7cc15706d",
   "byteSize": 1827,
   "mediaType": "application/json"
  },
  {
   "filePath": "baseline/known-issues.json",
   "sha256": "158454859cfb6406accae95d7c66953f23578ec15a23cd6848965e231ce1fff8",
   "byteSize": 4203,
   "mediaType": "application/json"
  },
  {
   "filePath": "conformance/closure-report.md",
   "sha256": "1c0dfe59c61a00805319737d0310977a0470cf6e14e3b905144f9c4ff3b298d4",
   "byteSize": 2568,
   "mediaType": "text/markdown"
  },
  {
   "filePath": "dataset/architecture.jsonld",
   "sha256": "364141576f85e8594ab3656920cadc81f6ce91b43d106bfe8c6140492ee5b9bc",
   "byteSize": 61476,
   "mediaType": "application/ld+json"
  },
  {
   "filePath": "dataset/assessment.jsonld",
   "sha256": "a8bb7ce896871e37fa1fbbbe73caaa61a45141941deb8dcaa9b87d55ebf36fcc",
   "byteSize": 76189,
   "mediaType": "application/ld+json"
  },
  {
   "filePath": "dataset/capability.jsonld",
   "sha256": "30721b27635721b57739d1336d72b07805266942097addcd548685ae19531d7f",
   "byteSize": 10609,
   "mediaType": "application/ld+json"
  },
  {
   "filePath": "dataset/continuing-assurance.jsonld",
   "sha256": "7ec7892d420ad2ae00d5abd2ca53f4f0ee41fd7112d9dba62eb95728c2f580f0",
   "byteSize": 24322,
   "mediaType": "application/ld+json"
  },
  {
   "filePath": "dataset/decision.jsonld",
   "sha256": "598427b7ecb3b81f2656fd04524d7f93b62080e746e178230f56d0593a556b6e",
   "byteSize": 113977,
   "mediaType": "application/ld+json"
  },
  {
   "filePath": "dataset/evidence.jsonld",
   "sha256": "e7501d40e65ca14ca39fabec98907cef7bd968e3a6279c522b7429b3f59b064d",
   "byteSize": 55405,
   "mediaType": "application/ld+json"
  },
  {
   "filePath": "dataset/failure.jsonld",
   "sha256": "fbb2a9dc6b988d1c9a0fadf2171dffaf3e2c90c33c9c82d61a2a3c64b16aa83e",
   "byteSize": 39060,
   "mediaType": "application/ld+json"
  },
  {
   "filePath": "dataset/framework.jsonld",
   "sha256": "15747613c74c5734b7dad679cf5bdf992ac7dfabfb0fedfa1b372d6dc1cc1e43",
   "byteSize": 1796600,
   "mediaType": "application/ld+json"
  },
  {
   "filePath": "dataset/organisation.jsonld",
   "sha256": "cde0b4f93de2e79d0d1f17ae75630e7f767f722b0c299e9318c7c650a106a6e4",
   "byteSize": 21098,
   "mediaType": "application/ld+json"
  },
  {
   "filePath": "dataset/relationships.jsonld",
   "sha256": "4d3fdd150b6da5c633c65f7a5cc9647973f3b33434523fb974b7a21608c4051b",
   "byteSize": 2355709,
   "mediaType": "application/ld+json"
  },
  {
   "filePath": "evidence-fixtures/EV-001.txt",
   "sha256": "9a2ae9d7398dae7b2ce734f4721c80a0ef31da28f7f69814458ba53c9cff63f9",
   "byteSize": 281,
   "mediaType": "text/plain"
  },
  {
   "filePath": "evidence-fixtures/EV-002.txt",
   "sha256": "88d4a879ebf6951d99e541190cd7372a4203641cdeb20fb980516fcae68cb94d",
   "byteSize": 281,
   "mediaType": "text/plain"
  },
  {
   "filePath": "evidence-fixtures/EV-003.txt",
   "sha256": "b8f4dae1acbaf7f21fddb318af6c77cc140cb01e982837c10712a7ff14c3424f",
   "byteSize": 281,
   "mediaType": "text/plain"
  },
  {
   "filePath": "evidence-fixtures/EV-004.txt",
   "sha256": "83226369e6544f72423e6115dcada9ff8660f6f6537141c23e89775dc97dd351",
   "byteSize": 281,
   "mediaType": "text/plain"
  },
  {
   "filePath": "evidence-fixtures/EV-005.txt",
   "sha256": "76c682c3a5f52237f6d6cf97f1280c12f1cb40894fae2152fe17442882cc6faa",
   "byteSize": 281,
   "mediaType": "text/plain"
  },
  {
   "filePath": "evidence-fixtures/EV-006.txt",
   "sha256": "3be5659f1e70c79a2a034facb35ef3f19d251fbca9d546f2faa96898dcdb3074",
   "byteSize": 285,
   "mediaType": "text/plain"
  },
  {
   "filePath": "evidence-fixtures/EV-007.txt",
   "sha256": "cb1e01cd623e6b792841055088e9645f2599839ef6ee3aacb73407446055c422",
   "byteSize": 281,
   "mediaType": "text/plain"
  },
  {
   "filePath": "evidence-fixtures/EV-008.txt",
   "sha256": "06b688deff0bbbb7b3d99eba36bf911bd310184c1aa5b126f56efc47cedadd53",
   "byteSize": 285,
   "mediaType": "text/plain"
  },
  {
   "filePath": "evidence-fixtures/EV-009.txt",
   "sha256": "f32fc25533ff9e823d421b511685c895dddfa5c353933ad328eb9977eed6ff5b",
   "byteSize": 281,
   "mediaType": "text/plain"
  },
  {
   "filePath": "evidence-fixtures/EV-010.txt",
   "sha256": "bb11d2bec4430460a879563919277e6c5b78c219435dff3ec2cafa71bf2371be",
   "byteSize": 281,
   "mediaType": "text/plain"
  },
  {
   "filePath": "evidence-fixtures/EV-011.txt",
   "sha256": "1e0ccc89cb586492fd114aa799afab94cab74df0dbbeee2304be4d36264ff184",
   "byteSize": 281,
   "mediaType": "text/plain"
  },
  {
   "filePath": "evidence-fixtures/EV-012.txt",
   "sha256": "aa63b613e3ed6f90c9d3c8e4fec2d84685dfbdf92e3fd9949426eebfc20b8013",
   "byteSize": 281,
   "mediaType": "text/plain"
  },
  {
   "filePath": "evidence-fixtures/EV-013.txt",
   "sha256": "9520065727c083eeca9ab7ad1b432af58481bcd375655b2fceb32c7c4efa3fe3",
   "byteSize": 285,
   "mediaType": "text/plain"
  },
  {
   "filePath": "evidence-fixtures/EV-014.txt",
   "sha256": "458d4fa49d004ef41ee11432b0133f7836594c82219ede2e6729dce646c30521",
   "byteSize": 279,
   "mediaType": "text/plain"
  },
  {
   "filePath": "evidence-fixtures/EV-015.txt",
   "sha256": "c915f2708431fecc905a78ac4e4261a040aa504998dbd9ad48396c6965632344",
   "byteSize": 285,
   "mediaType": "text/plain"
  },
  {
   "filePath": "evidence-fixtures/EV-016.txt",
   "sha256": "78768a5984a2dda628978661a719dbd441df07f611afa00db4aa2b01c09cdeee",
   "byteSize": 285,
   "mediaType": "text/plain"
  },
  {
   "filePath": "evidence-fixtures/EV-017.txt",
   "sha256": "5c9f749bea5d4fba03113dec138e0867fb710e4d0e3c6d1e15653dc922e52d23",
   "byteSize": 281,
   "mediaType": "text/plain"
  },
  {
   "filePath": "evidence-fixtures/EV-018.txt",
   "sha256": "008c40d6c9f50bb747aa3982b0a1b41ed5312e68674e1ae12ff5d2ad5a872ccf",
   "byteSize": 279,
   "mediaType": "text/plain"
  },
  {
   "filePath": "evidence-fixtures/EV-019.txt",
   "sha256": "11d679946646af01abcb43d1f5f4e941011a3ab83011b229c0ea5b40c33777dd",
   "byteSize": 279,
   "mediaType": "text/plain"
  },
  {
   "filePath": "evidence-fixtures/EV-020.txt",
   "sha256": "299985ec090d416b58656001390b9a2ad81f125d33dfb8398e6e609125c032c4",
   "byteSize": 279,
   "mediaType": "text/plain"
  },
  {
   "filePath": "evidence-fixtures/EV-021.txt",
   "sha256": "ed193f869b9e40340f007de7f6afb2557aa05052891ae9cf63077c66fcce5939",
   "byteSize": 281,
   "mediaType": "text/plain"
  },
  {
   "filePath": "evidence-fixtures/EV-022.txt",
   "sha256": "9f470e669576e9b1ea79ae57cd60381a34708f78aced96c0b597f44d9f44305e",
   "byteSize": 267,
   "mediaType": "text/plain"
  },
  {
   "filePath": "evidence-fixtures/EV-023.txt",
   "sha256": "bd057e045468c2574722bb70bd39448bc17032564d79f831dceec6f14cf44a10",
   "byteSize": 285,
   "mediaType": "text/plain"
  },
  {
   "filePath": "evidence-fixtures/EV-024.txt",
   "sha256": "8028ee58c165fc5ad99e15233f62ea352bde1acfb589836d4fb5ced236585d0a",
   "byteSize": 281,
   "mediaType": "text/plain"
  },
  {
   "filePath": "evidence-fixtures/EV-025.txt",
   "sha256": "5d924aa10f4318c512eba57491f3928199672aeed8f42ea7142672420288b927",
   "byteSize": 281,
   "mediaType": "text/plain"
  },
  {
   "filePath": "evidence-fixtures/EV-026.txt",
   "sha256": "6cb4e87a6649446159ca161f2c0cf00a478b179010e48ccbbd5be11dcdd852e7",
   "byteSize": 285,
   "mediaType": "text/plain"
  },
  {
   "filePath": "evidence-fixtures/EV-027.txt",
   "sha256": "a679b78052ed1970a080df0a84eed035026daa39bedb60eea400f08a8de0acae",
   "byteSize": 285,
   "mediaType": "text/plain"
  },
  {
   "filePath": "evidence-fixtures/EV-028.txt",
   "sha256": "bf1460308e36510411a11ed666811969be6dfb7bc0496d15ce94b8663990a8f9",
   "byteSize": 281,
   "mediaType": "text/plain"
  },
  {
   "filePath": "evidence-fixtures/EV-029.txt",
   "sha256": "5793661c30236a758ee20667ff7a3deb4239ed828ac1c66b4d54630298bb674e",
   "byteSize": 267,
   "mediaType": "text/plain"
  },
  {
   "filePath": "evidence-fixtures/EV-030.txt",
   "sha256": "89bbab1d68b4c019651bd81a4ecde653680dfbd74cee9d1d0dc088705c0974cb",
   "byteSize": 279,
   "mediaType": "text/plain"
  },
  {
   "filePath": "evidence-fixtures/EV-031.txt",
   "sha256": "9124c53fe6fc949c775b3ded76b7276638a2e42b52a6c1d12008dec8a2dcdc6d",
   "byteSize": 251,
   "mediaType": "text/plain"
  },
  {
   "filePath": "evidence-fixtures/EV-ARCH-01.txt",
   "sha256": "069357b6d4ffa36c9e698e7a989e95202b2863156cfb91c7a994e29d972e163f",
   "byteSize": 298,
   "mediaType": "text/plain"
  },
  {
   "filePath": "evidence-fixtures/EV-ARCH-02.txt",
   "sha256": "b14c95297a7e76f8f57479041efefd40ae9cf88546f634cbf4fdcdb95fb2aaef",
   "byteSize": 301,
   "mediaType": "text/plain"
  },
  {
   "filePath": "evidence-fixtures/EV-ARCH-03.txt",